{
  "esquema": "panlabs-aws-diagrams/modelo@1",
  "id": "landing-zone",
  "titulo": "Landing zone · seis contas em três OUs",
  "subtitulo": "Vista técnica T5 · o conjunto canônico do AWS SRA — mesmo vocabulário do outro modelo, outro modo de vista",
  "vista": "tecnica",
  "genero": "T5",

  "nos": [
    { "id": "nuvem", "tipo": "nuvem", "rotulo": "AWS Cloud" },

    { "id": "c-mgmt", "tipo": "conta", "conta": "100000000001", "rotulo": "Org Management", "dentro": "nuvem" },
    { "id": "orgs", "tipo": "servico", "servico": "organizations", "rotulo": "Organizations", "dentro": "c-mgmt" },
    { "id": "ct", "tipo": "servico", "servico": "control tower", "rotulo": "Control Tower", "dentro": "c-mgmt" },

    { "id": "c-sec", "tipo": "conta", "conta": "100000000002", "ou": "Security", "rotulo": "Security Tooling", "dentro": "nuvem" },
    { "id": "hub", "tipo": "servico", "servico": "security hub", "rotulo": "Security Hub", "dentro": "c-sec" },
    { "id": "gd", "tipo": "servico", "servico": "guardduty", "rotulo": "GuardDuty", "dentro": "c-sec" },

    { "id": "c-log", "tipo": "conta", "conta": "100000000003", "ou": "Security", "rotulo": "Log Archive", "dentro": "nuvem" },
    { "id": "trilha", "tipo": "servico", "servico": "cloudtrail", "rotulo": "CloudTrail", "dentro": "c-log" },
    { "id": "balde", "tipo": "servico", "servico": "s3", "rotulo": "Log bucket", "dentro": "c-log" },
    { "id": "politica", "tipo": "servico", "servico": "iam", "rotulo": "Bucket policy", "dentro": "c-log", "habilita": "balde" },

    { "id": "c-net", "tipo": "conta", "conta": "100000000004", "ou": "Infrastructure", "rotulo": "Network", "dentro": "nuvem" },
    { "id": "tgw", "tipo": "servico", "servico": "transit gateway", "rotulo": "Transit Gateway", "dentro": "c-net" },
    { "id": "vpc-net", "tipo": "vpc", "rotulo": "VPC de egresso", "cidr": "10.0.0.0/16", "dentro": "c-net" },
    { "id": "sub-net", "tipo": "subnet", "rotulo": "Public subnet", "acesso": "publica", "dentro": "vpc-net" },
    { "id": "nat", "tipo": "servico", "servico": "nat gateway", "rotulo": "NAT gateway", "dentro": "sub-net" },

    { "id": "c-shared", "tipo": "conta", "conta": "100000000005", "ou": "Infrastructure", "rotulo": "Shared Services", "dentro": "nuvem" },
    { "id": "idc", "tipo": "servico", "servico": "iam identity center", "rotulo": "IAM Identity Center", "dentro": "c-shared" },
    { "id": "r53", "tipo": "servico", "servico": "route 53", "rotulo": "Route 53 resolver", "dentro": "c-shared" },

    { "id": "c-app", "tipo": "conta", "conta": "100000000006", "ou": "Workloads", "rotulo": "Application", "dentro": "nuvem" },
    { "id": "vpc-app", "tipo": "vpc", "rotulo": "VPC de aplicação", "cidr": "10.1.0.0/16", "dentro": "c-app" },
    { "id": "sub-app", "tipo": "subnet", "rotulo": "Private subnet", "acesso": "privada", "dentro": "vpc-app" },
    { "id": "ecs", "tipo": "servico", "servico": "ecs", "rotulo": "ECS", "dentro": "sub-app" },
    { "id": "rds", "tipo": "servico", "servico": "rds", "rotulo": "RDS", "dentro": "sub-app" }
  ],

  "arestas": [
    { "de": "trilha", "para": "balde", "rotulo": "grava trilha da organização" },
    { "de": "ecs", "para": "rds", "rotulo": "consulta", "protocolo": "sql" },
    { "de": "gd", "para": "hub", "rotulo": "achados" },
    { "de": "ecs", "para": "balde", "rotulo": "logs de acesso" },
    { "de": "nat", "para": "tgw", "rotulo": "egresso centralizado" },
    { "de": "idc", "para": "ecs", "rotulo": "acesso federado" }
  ],

  "notas": [
    { "texto": "As colunas de OU não estão no modelo — cada conta só declara a dimensão \"ou\". O motor decidiu que a declaração agrupa (uma OU com ≥2 contas, e conta fora dela) e desenhou os rótulos, sem caixa: o deck oficial não tem shape de Organizational unit.", "origem": "legenda" },
    { "texto": "As travessias de conta foram SUPRIMIDAS nesta vista. É a regra soberana E1 do #6: o diagrama multi-conta carro-chefe da AWS (SRA slide 3, 6 contas) tem zero conectores. Elas aparecem em texto nas vistas de detalhe, uma por conta.", "origem": "legenda" }
  ]
}
