{
  "esquema": "panlabs-aws-diagrams/modelo@1",
  "id": "logica-pedidos",
  "titulo": "Pedidos · vista lógica",
  "subtitulo": "L2 · a mesma arquitetura antes de nomear serviço — premissa 2 do mapa",
  "vista": "logica",
  "genero": "L2",


  "nos": [
    { "id": "cliente", "tipo": "ator", "servico": "users", "rotulo": "Clientes",
      "qualificador": "app móvel e web" },
    { "id": "borda", "tipo": "bloco", "rotulo": "Borda pública",
      "qualificador": "autentica e limita taxa" },
    { "id": "processa", "tipo": "bloco", "rotulo": "Processamento de pedido",
      "qualificador": "valida, calcula, persiste" },
    { "id": "catalogo", "tipo": "bloco", "rotulo": "Catálogo de produtos",
      "qualificador": "leitura consistente" },
    { "id": "registro", "tipo": "bloco", "rotulo": "Registro de pedidos",
      "qualificador": "escrita de alto volume" }
  ],

  "arestas": [
    { "de": "cliente", "para": "borda", "rotulo": "faz pedido", "ordem": 1 },
    { "de": "borda", "para": "processa", "rotulo": "encaminha", "ordem": 2 },
    { "de": "processa", "para": "catalogo", "rotulo": "consulta preço", "ordem": 3 },
    { "de": "processa", "para": "registro", "rotulo": "grava", "ordem": 4 }
  ],

  "notas": [
    { "id": "nota-fronteira",
      "texto": "Agrupado por fronteira de responsabilidade, não por conta AWS — decisão do #15, tomada contra render real.",
      "origem": "premissa" }
  ]
}
