{
  "esquema": "panlabs-aws-diagrams/modelo@1",
  "id": "web-asg-com-vizinho",
  "titulo": "Web · Auto Scaling group com vizinho de subnet",
  "subtitulo": "T4 · dois membros do ASG em AZs distintas, um terceiro serviço na subnet do primeiro deles",
  "vista": "tecnica",
  "genero": "T4",

  "nos": [
    { "id": "nuvem", "tipo": "nuvem", "rotulo": "AWS Cloud" },
    { "id": "vpc", "tipo": "vpc", "rotulo": "VPC de produção · 10.0.0.0/16", "cidr": "10.0.0.0/16", "dentro": "nuvem" },

    { "id": "app-a", "tipo": "subnet", "rotulo": "App subnet", "acesso": "privada", "az": "us-east-1a", "dentro": "vpc" },
    { "id": "app-b", "tipo": "subnet", "rotulo": "App subnet", "acesso": "privada", "az": "us-east-1b", "dentro": "vpc" },

    { "id": "web-a", "tipo": "servico", "servico": "ec2", "rotulo": "EC2 · web", "dentro": "app-a" },
    { "id": "fraude-a", "tipo": "servico", "servico": "lambda", "rotulo": "Lambda · antifraude", "dentro": "app-a" },
    { "id": "web-b", "tipo": "servico", "servico": "ec2", "rotulo": "EC2 · web", "dentro": "app-b" }
  ],

  "arestas": [
    { "de": "web-a", "para": "fraude-a", "rotulo": "pontua o risco", "ordem": 1 },
    { "de": "web-a", "para": "web-b", "rotulo": "sincroniza sessão", "ordem": 2 }
  ],

  "faixas": [
    { "id": "asg-web", "tipo": "auto-scaling", "rotulo": "Auto Scaling group", "membros": ["web-a", "web-b"] }
  ],

  "notas": [
    {
      "texto": "fraude-a mora na mesma subnet de web-a e NÃO escala com o grupo. Na grade, a faixa é a união das subnets inteiras dos membros (app-a e app-b) — sem degradar, qualquer vizinho de web-a cairia dentro da caixa. É o caso frequente do #31: aqui a faixa vira rótulo em vez de afirmar um atributo que fraude-a não tem.",
      "origem": "legenda"
    }
  ]
}
