{
  "esquema": "panlabs-aws-diagrams/modelo@1",
  "id": "logica-atendimento",
  "titulo": "Atendimento · capacidades e fronteiras",
  "subtitulo": "L1 · blocos lógicos agrupados por fronteira de responsabilidade, sem passo numerado e sem um nome de serviço",
  "vista": "logica",
  "genero": "L1",

  "nos": [
    { "id": "cliente", "tipo": "ator", "servico": "users", "rotulo": "Cliente final",
      "qualificador": "web, app e telefone" },
    { "id": "atendente", "tipo": "ator", "servico": "user", "rotulo": "Atendente",
      "qualificador": "opera pelo console interno" },

    { "id": "canais", "tipo": "grupo", "rotulo": "Canais",
      "qualificador": "dono: time de experiência" },
    { "id": "recepcao", "tipo": "bloco", "rotulo": "Recepção de contato", "dentro": "canais",
      "qualificador": "identifica e classifica" },
    { "id": "roteamento", "tipo": "bloco", "rotulo": "Roteamento de fila", "dentro": "canais",
      "qualificador": "escolhe quem atende" },

    { "id": "nucleo", "tipo": "grupo", "rotulo": "Núcleo de atendimento",
      "qualificador": "dono: time de operações" },
    { "id": "caso", "tipo": "bloco", "rotulo": "Gestão de casos", "dentro": "nucleo",
      "qualificador": "abre, transfere, encerra" },
    { "id": "conhecimento", "tipo": "bloco", "rotulo": "Base de conhecimento", "dentro": "nucleo",
      "qualificador": "respostas revisadas" },

    { "id": "governanca", "tipo": "grupo", "rotulo": "Governança",
      "qualificador": "dono: jurídico e compliance" },
    { "id": "trilha", "tipo": "bloco", "rotulo": "Trilha de auditoria", "dentro": "governanca",
      "qualificador": "quem viu o quê, e quando" },
    { "id": "retencao", "tipo": "bloco", "rotulo": "Política de retenção", "dentro": "governanca",
      "qualificador": "cinco anos, imutável" }
  ],

  "arestas": [
    { "de": "cliente", "para": "recepcao", "rotulo": "abre contato" },
    { "de": "recepcao", "para": "roteamento", "rotulo": "classifica" },
    { "de": "roteamento", "para": "caso", "rotulo": "abre caso" },
    { "de": "atendente", "para": "caso", "rotulo": "trabalha o caso" },
    { "de": "caso", "para": "conhecimento", "rotulo": "consulta resposta", "dados": "volta" },
    { "de": "caso", "para": "trilha", "rotulo": "registra acesso" },
    { "de": "trilha", "para": "retencao", "rotulo": "obedece" }
  ],

  "notas": [
    { "id": "nota-fronteira",
      "texto": "Os três grupos são fronteiras de RESPONSABILIDADE, não contas AWS (#15 §6). Esta vista é mostrada a produto, jurídico e diretoria — o vocabulário é de capacidade, e nenhum nome de tecnologia aparece.",
      "origem": "premissa" }
  ],

  "dossie": {
    "_comentario": "L1 do corpus do #26: o gênero de blocos lógicos SEM passo numerado, que é o regime em que eixoDaGrade devolve `coluna` e o ELK fica com o grafo inteiro.",
    "eixos": {
      "E1": "não decidido — a vista lógica é anterior à postura de computação",
      "E2": "síncrono no contato, assíncrono na trilha",
      "E3": "casos com histórico longo e retenção legal",
      "E4": "canal público de entrada, núcleo interno",
      "E5": "três fronteiras: canais, núcleo, governança"
    }
  }
}
