{
  "esquema": "panlabs-aws-diagrams/modelo@1",
  "id": "educacao-8-contas",
  "titulo": "Secretaria de Educação · inventário das 8 contas",
  "subtitulo": "T5 multi-account, modo inventário — acima de 4 contas o motor SUPRIME toda travessia, e diz que suprimiu.",
  "vista": "tecnica",
  "genero": "T5",
  "nos": [
    { "id": "c-rede", "tipo": "conta", "conta": "100000000001", "ou": "Infraestrutura", "rotulo": "Rede", "qualificador": "trânsito e saída para a internet" },
    { "id": "c-seg", "tipo": "conta", "conta": "100000000002", "ou": "Segurança", "rotulo": "Segurança", "qualificador": "logs, achados e chaves" },
    { "id": "c-dados", "tipo": "conta", "conta": "100000000003", "ou": "Plataforma", "rotulo": "Dados", "qualificador": "censo escolar e frequência" },
    { "id": "c-ident", "tipo": "conta", "conta": "100000000004", "ou": "Plataforma", "rotulo": "Identidade", "qualificador": "aluno, professor e responsável" },
    { "id": "c-norte", "tipo": "conta", "conta": "100000000005", "ou": "Regionais", "rotulo": "Regional Norte", "qualificador": "312 escolas" },
    { "id": "c-sul", "tipo": "conta", "conta": "100000000006", "ou": "Regionais", "rotulo": "Regional Sul", "qualificador": "287 escolas" },
    { "id": "c-leste", "tipo": "conta", "conta": "100000000007", "ou": "Regionais", "rotulo": "Regional Leste", "qualificador": "401 escolas" },
    { "id": "c-oeste", "tipo": "conta", "conta": "100000000008", "ou": "Regionais", "rotulo": "Regional Oeste", "qualificador": "198 escolas" },

    { "id": "tgw", "tipo": "servico", "servico": "transit gateway", "dentro": "c-rede", "rotulo": "Transit Gateway" },
    { "id": "egress", "tipo": "servico", "servico": "nat gateway", "dentro": "c-rede", "rotulo": "Egress centralizado" },

    { "id": "logs", "tipo": "servico", "servico": "s3", "dentro": "c-seg", "rotulo": "S3 · trilha consolidada", "qualificador": "Object Lock, 5 anos" },
    { "id": "achados", "tipo": "servico", "servico": "security hub", "dentro": "c-seg", "rotulo": "Security Hub" },
    { "id": "chave", "tipo": "servico", "servico": "kms", "dentro": "c-seg", "rotulo": "KMS · chave da secretaria" },

    { "id": "lake", "tipo": "servico", "servico": "s3", "dentro": "c-dados", "rotulo": "S3 · data lake", "qualificador": "censo, frequência, merenda" },
    { "id": "catalogo", "tipo": "servico", "servico": "glue", "dentro": "c-dados", "rotulo": "Glue Data Catalog" },
    { "id": "consulta", "tipo": "servico", "servico": "athena", "dentro": "c-dados", "rotulo": "Athena" },

    { "id": "idp", "tipo": "servico", "servico": "cognito", "dentro": "c-ident", "rotulo": "Cognito · portal do aluno" },
    { "id": "sso", "tipo": "servico", "servico": "single sign-on", "dentro": "c-ident", "rotulo": "IAM Identity Center", "qualificador": "servidores da rede" },

    { "id": "app-norte", "tipo": "servico", "servico": "ecs", "dentro": "c-norte", "rotulo": "ECS · diário de classe" },
    { "id": "app-sul", "tipo": "servico", "servico": "ecs", "dentro": "c-sul", "rotulo": "ECS · diário de classe" },
    { "id": "app-leste", "tipo": "servico", "servico": "ecs", "dentro": "c-leste", "rotulo": "ECS · diário de classe" },
    { "id": "app-oeste", "tipo": "servico", "servico": "ecs", "dentro": "c-oeste", "rotulo": "ECS · diário de classe" }
  ],
  "arestas": [
    { "id": "t-norte", "de": "app-norte", "para": "lake", "rotulo": "envia frequência" },
    { "id": "t-sul", "de": "app-sul", "para": "lake", "rotulo": "envia frequência" },
    { "id": "t-leste", "de": "app-leste", "para": "lake", "rotulo": "envia frequência" },
    { "id": "t-oeste", "de": "app-oeste", "para": "lake", "rotulo": "envia frequência" },
    { "id": "t-idn", "de": "app-norte", "para": "idp", "rotulo": "autentica o professor" },
    { "id": "t-ids", "de": "app-sul", "para": "idp", "rotulo": "autentica o professor" },
    { "id": "t-idl", "de": "app-leste", "para": "idp", "rotulo": "autentica o professor" },
    { "id": "t-ido", "de": "app-oeste", "para": "idp", "rotulo": "autentica o professor" },
    { "id": "t-log", "de": "achados", "para": "logs", "rotulo": "consolida os achados" },
    { "id": "t-cat", "de": "consulta", "para": "catalogo", "rotulo": "resolve o esquema" }
  ],
  "notas": [
    {
      "id": "n-inventario",
      "origem": "premissa",
      "texto": "Esta é a vista consolidada de INVENTÁRIO: quem existe e sob qual OU. As travessias entre contas estão nas vistas de detalhe, uma por conta — é o corte 1+N do deck oficial da AWS, que publica a consolidada com zero conector."
    }
  ]
}
