{
  "esquema": "panlabs-aws-diagrams/modelo@1",
  "id": "farmacias-canal-digital",
  "titulo": "Rede de farmácias · novo canal digital",
  "subtitulo": "L1 blocos lógicos — a vista que foi ao comitê. Capacidades e fronteiras de responsabilidade, zero nome de serviço AWS.",
  "vista": "logica",
  "genero": "L1",
  "nos": [
    { "id": "cliente", "tipo": "ator", "rotulo": "Cliente", "qualificador": "app, site e WhatsApp" },
    { "id": "farmaceutico", "tipo": "ator", "rotulo": "Farmacêutico", "qualificador": "480 lojas, valida a receita" },
    { "id": "convenio", "tipo": "ator", "rotulo": "Convênio e PBM", "qualificador": "autoriza o desconto" },

    { "id": "f-venda", "tipo": "grupo", "rotulo": "Venda", "qualificador": "dono: produto digital" },
    { "id": "f-receita", "tipo": "grupo", "rotulo": "Receita e conformidade", "qualificador": "dono: farmácia clínica" },
    { "id": "f-entrega", "tipo": "grupo", "rotulo": "Entrega", "qualificador": "dono: logística" },

    { "id": "catalogo", "tipo": "bloco", "dentro": "f-venda", "rotulo": "Catálogo e preço", "qualificador": "preço por loja e por convênio" },
    { "id": "carrinho", "tipo": "bloco", "dentro": "f-venda", "rotulo": "Carrinho e pagamento" },
    { "id": "identidade", "tipo": "bloco", "dentro": "f-venda", "rotulo": "Identidade do cliente", "qualificador": "CPF é a chave em todos os canais" },

    { "id": "receita", "tipo": "bloco", "dentro": "f-receita", "rotulo": "Guarda da receita", "qualificador": "controlado exige receita retida" },
    { "id": "validacao", "tipo": "bloco", "dentro": "f-receita", "rotulo": "Validação farmacêutica" },
    { "id": "trilha", "tipo": "bloco", "dentro": "f-receita", "rotulo": "Trilha regulatória", "qualificador": "SNGPC — quem vendeu o quê, para quem" },

    { "id": "estoque", "tipo": "bloco", "dentro": "f-entrega", "rotulo": "Estoque por loja" },
    { "id": "roteirizacao", "tipo": "bloco", "dentro": "f-entrega", "rotulo": "Roteirização", "qualificador": "loja mais próxima que tem o item" },
    { "id": "rastreio", "tipo": "bloco", "dentro": "f-entrega", "rotulo": "Rastreio da entrega" }
  ],
  "arestas": [
    { "id": "a-navega", "de": "cliente", "para": "catalogo", "rotulo": "consulta preço e disponibilidade" },
    { "id": "a-compra", "de": "cliente", "para": "carrinho", "rotulo": "compra" },
    { "id": "a-ident", "de": "carrinho", "para": "identidade", "rotulo": "identifica o comprador" },
    { "id": "a-envia", "de": "cliente", "para": "receita", "rotulo": "envia a foto da receita" },
    { "id": "a-valida", "de": "farmaceutico", "para": "validacao", "rotulo": "valida ou recusa" },
    { "id": "a-guarda", "de": "validacao", "para": "trilha", "rotulo": "registra a dispensação" },
    { "id": "a-desconto", "de": "carrinho", "para": "convenio", "rotulo": "pede autorização de desconto" },
    { "id": "a-libera", "de": "validacao", "para": "estoque", "rotulo": "libera a separação" },
    { "id": "a-rota", "de": "estoque", "para": "roteirizacao", "rotulo": "escolhe a loja de origem" },
    { "id": "a-rastreia", "de": "roteirizacao", "para": "rastreio", "rotulo": "abre o rastreio" },
    { "id": "a-ve", "de": "cliente", "para": "rastreio", "rotulo": "acompanha", "dados": "volta" }
  ],
  "notas": [
    {
      "id": "n-fronteira",
      "origem": "premissa",
      "texto": "Os três grupos são fronteiras de RESPONSABILIDADE, não contas AWS. Esta vista foi mostrada ao comitê e ao jurídico — nenhum nome de serviço entrou de propósito."
    },
    {
      "id": "n-controlado",
      "origem": "premissa",
      "sobre": "receita",
      "texto": "Medicamento controlado não sai do canal digital sem receita retida (Portaria 344). A capacidade existe desde a v1, não é fase 2."
    }
  ]
}
