{
  "esquema": "panlabs-aws-diagrams/modelo@1",
  "id": "ingressos-abertura",
  "titulo": "Marketplace de ingressos · a abertura de vendas",
  "subtitulo": "T4 fluxo de requisição numerado — 50 mil pessoas em dois minutos, fila virtual antes do estoque.",
  "vista": "tecnica",
  "genero": "T4",
  "nos": [
    { "id": "nuvem", "tipo": "nuvem", "rotulo": "AWS Cloud · sa-east-1" },
    { "id": "vpc", "tipo": "vpc", "dentro": "nuvem", "rotulo": "VPC venda · 10.40.0.0/16", "cidr": "10.40.0.0/16" },

    { "id": "sub-pub-a", "tipo": "subnet", "dentro": "vpc", "rotulo": "Public subnet", "acesso": "publica", "az": "sa-east-1a", "cidr": "10.40.1.0/24" },
    { "id": "sub-pub-b", "tipo": "subnet", "dentro": "vpc", "rotulo": "Public subnet", "acesso": "publica", "az": "sa-east-1b", "cidr": "10.40.2.0/24" },
    { "id": "sub-app-a", "tipo": "subnet", "dentro": "vpc", "rotulo": "Private subnet · venda", "acesso": "privada", "az": "sa-east-1a", "cidr": "10.40.11.0/24" },
    { "id": "sub-app-b", "tipo": "subnet", "dentro": "vpc", "rotulo": "Private subnet · venda", "acesso": "privada", "az": "sa-east-1b", "cidr": "10.40.12.0/24" },
    { "id": "sub-dado-a", "tipo": "subnet", "dentro": "vpc", "rotulo": "Private subnet · estoque", "acesso": "privada", "az": "sa-east-1a", "cidr": "10.40.21.0/24" },
    { "id": "sub-dado-b", "tipo": "subnet", "dentro": "vpc", "rotulo": "Private subnet · estoque", "acesso": "privada", "az": "sa-east-1b", "cidr": "10.40.22.0/24" },

    { "id": "fila-a", "tipo": "servico", "servico": "elastic load balancing", "dentro": "sub-pub-a", "rotulo": "ALB · fila virtual", "qualificador": "segura o pico antes do estoque" },
    { "id": "fila-b", "tipo": "servico", "servico": "elastic load balancing", "dentro": "sub-pub-b", "rotulo": "ALB · fila virtual" },

    { "id": "venda-a", "tipo": "servico", "servico": "ecs", "dentro": "sub-app-a", "rotulo": "ECS · reserva de assento" },
    { "id": "venda-b", "tipo": "servico", "servico": "ecs", "dentro": "sub-app-b", "rotulo": "ECS · reserva de assento" },
    { "id": "fraude-a", "tipo": "servico", "servico": "lambda", "dentro": "sub-app-a", "rotulo": "Lambda · antifraude", "qualificador": "cartão e velocidade de compra" },

    { "id": "assento-a", "tipo": "servico", "servico": "dynamodb", "dentro": "sub-dado-a", "rotulo": "DynamoDB · mapa de assentos", "qualificador": "escrita condicional, um assento por vez" },
    { "id": "assento-b", "tipo": "servico", "servico": "dynamodb", "dentro": "sub-dado-b", "rotulo": "DynamoDB · mapa de assentos" },
    { "id": "pedido-a", "tipo": "servico", "servico": "aurora", "dentro": "sub-dado-a", "rotulo": "Aurora · pedido e pagamento" }
  ],
  "faixas": [
    { "id": "asg-venda", "tipo": "auto-scaling", "rotulo": "Auto Scaling group · reserva", "membros": ["venda-a", "venda-b"] }
  ],
  "arestas": [
    { "id": "p1", "de": "fila-a", "para": "venda-a", "rotulo": "libera da fila", "protocolo": "https", "ordem": 1 },
    { "id": "p2", "de": "venda-a", "para": "assento-a", "rotulo": "reserva o assento", "ordem": 2 },
    { "id": "p3", "de": "venda-a", "para": "fraude-a", "rotulo": "pontua o risco", "ordem": 3 },
    { "id": "p4", "de": "venda-a", "para": "pedido-a", "rotulo": "fecha o pedido", "protocolo": "sql", "ordem": 4 },
    { "id": "p5", "de": "assento-a", "para": "assento-b", "rotulo": "replica o mapa", "ordem": 5 },
    { "id": "p6", "de": "fila-b", "para": "venda-b", "rotulo": "libera da fila", "protocolo": "https", "ordem": 6 },
    { "id": "p7", "de": "venda-b", "para": "assento-b", "rotulo": "reserva o assento", "ordem": 7 }
  ],
  "notas": [
    {
      "id": "n-fila",
      "origem": "premissa",
      "texto": "A fila virtual é requisito de negócio, não de capacidade: o time quer que quem entrou primeiro compre primeiro, e isso não é o que o autoscaling entrega."
    },
    {
      "id": "n-pedido",
      "origem": "achado-recusado",
      "sobre": "pedido-a",
      "texto": "Aurora de pedido em AZ única, conhecido e aceito para a abertura: o mapa de assentos é a verdade, o pedido é reconstruível a partir dele. Multi-AZ entra na fase 2."
    }
  ]
}
